Nome,Descrizione
Alimentari,Prodotti alimentari di vario genere
Giochi,videogiochi per tutte le piattaforme
Elettronica,Dispositivi elettronici come telefoni, computer e accessori
Abbigliamento,Abiti, scarpe e accessori per tutte le stagioni
Libri,Libri di vari generi e autori
Giocattoli,Giochi e giocattoli per bambini di tutte le età
Cucina,Utensili e accessori per la cucina
Sport,Attrezzature e abbigliamento sportivo
Bellezza,Prodotti per la cura della persona e cosmetici
Casa e Giardino,Articoli per la casa e il giardino
Automobili,Accessori e ricambi per automobili
Musica,Strumenti musicali e accessori
